{
  "schema": "locaily.development.milestone.v1",
  "id": "px6-external-validation-program",
  "title": "External Validation Program",
  "status": "blocked",
  "type": "validation",
  "priority": "high",
  "purpose": "Prove Locaily externally with three programs: five unassisted developer testers on Lighthouse Handoff, authenticated two-device Relay pilot, and one second real workflow used for actual work.",
  "problem": "Internal architecture confidence exceeds external proof. Need real usage to expose setup friction, output quality, and repeat-use value.",
  "scope": {
    "included": [
      "Tester protocol and feedback template for 5 developers completing Lighthouse Handoff without maintainer help",
      "Physical two-device Relay pilot runbook execution with authenticated LAN (using px2 gates)",
      "Select and implement or harden one second real workflow for repeated work (e.g. a11y/SEO/repo analysis/test triage) — minimal viable, not a platform",
      "Publish successes and failures as evidence artifacts under docs/04-validation or data/validation",
      "Capture metrics: time to first output, completion rate, blockers, repeat-use intent"
    ],
    "excluded": [
      "Paid user research firm",
      "Public launch marketing campaign",
      "More than one additional workflow beyond the chosen second wedge",
      "Changing core architecture based on single anecdote without evidence record"
    ]
  },
  "acceptanceCriteria": [
    {
      "id": "ac-five-testers",
      "description": "Protocol + materials exist; at least dry-run internally; results template ready for 5 external testers",
      "status": "pending"
    },
    {
      "id": "ac-relay-pilot",
      "description": "Authenticated two-device pilot completed or blocked with explicit evidence and residual risks",
      "status": "pending"
    },
    {
      "id": "ac-second-workflow",
      "description": "Second workflow runnable and used at least once for a non-demo task with evidence",
      "status": "satisfied"
    },
    {
      "id": "ac-published",
      "description": "Successes and failures published as validation evidence, not only chat notes",
      "status": "satisfied"
    }
  ],
  "validationProfile": "pre-delivery",
  "dependencies": [
    "px2-lan-security-hard-gate",
    "px5-tester-package"
  ],
  "blockers": [
    {
      "id": "px6-external-participants-and-hardware",
      "type": "hardware",
      "description": "Completion requires unassisted external testers and an authenticated second physical device; neither is available to the local coding runner.",
      "owner": "project owner",
      "resolutionCondition": "Provide external tester results and access to a second physical device for the authenticated relay pilot.",
      "createdAt": "2026-07-31T02:45:08.144Z"
    }
  ],
  "lifecycleRef": null,
  "createdAt": "2026-07-25T03:53:40.372Z",
  "startedAt": "2026-07-26T00:00:00.000Z",
  "completedAt": null,
  "mergedAt": null
}
