{
  "schema": "locaily.development.milestone.v1",
  "id": "09-physical-multi-device-pilot",
  "title": "M09: Physical Multi-Device Pilot",
  "status": "blocked",
  "type": "validation",
  "priority": "high",
  "purpose": "Execute multi-device workflow on physical hardware with paired relay nodes.",
  "scope": {
    "included": ["Physical device setup", "Real relay pairing", "Performance comparison", "Node loss testing"],
    "excluded": ["Relay trust (separate milestone)", "Packaging"]
  },
  "acceptanceCriteria": [
    "Two physical devices with Ollama running",
    "Workflow executes across devices",
    "Performance measured vs local-only",
    "Node loss/fallback tested"
  ],
  "validationProfile": "builtin-quick",
  "dependencies": ["06-trusted-relay-execution"],
  "blockers": [
    {
      "id": "blocker-hardware",
      "type": "hardware",
      "description": "Requires two physical devices with Ollama",
      "resolutionCondition": "Two devices available and configured",
      "createdAt": "2026-07-14T00:00:00.000Z"
    }
  ],
  "lifecycleRef": null,
  "createdAt": "2026-07-14T00:00:00.000Z",
  "startedAt": null,
  "completedAt": null
}
